
5812305257,2026-07-23,2026-07-24,Investment Analyst,Ethos BeathChapman,Singapore,investment analyst,2,0.351,0.326,valuation,False,"The role requires 1-6 years of relevant M&A/Corporate Finance/Investment Banking experience, but the student only has 4 months of data analytics internship experience with no investment banking or M&A background. While the student has strong quantitative and finance knowledge, the posting explicitly states candidates must have relevant M&A/Corporate Finance experience, which is a significant gap.",False,not_applied
5812360527,2026-07-23,2026-07-24,Murex Credit Risk Consultant,Luxoft,Singapore,business analyst,0,0.384,0.322,,False,"The role requires 6-8 years of specialized Murex MLC experience, which far exceeds the student's 4-month internship background. The posting explicitly seeks an experienced credit risk consultant with deep domain expertise in treasury systems, not an entry-level analyst role suitable for a final-year graduate.",False,not_applied
5812013289,2026-07-23,2026-07-24,Java Developer - Investment Bank,The Career Works Limited,Singapore,business analyst,0,0.374,0.304,,False,"Role requires 3+ years of Java development experience, but student only has 4 months of data analytics internship with no professional Java development background. Core required skills (Java, Spring Boot, AWS, SQL databases) don't align with student's primary focus on data analytics, business analytics, and finance roles.",False,not_applied
jooble_4052755860584906951,2026-07-23,2026-07-24,Business Analyst - Modern ERP,Exasoft Pte Ltd,Singapore,business analyst|data analyst|business intelligence analyst|investment analyst|risk analyst|financial analyst|graduate analyst,0,0.285,0.136,,False,,True,not_applied
5812471226,2026-07-23,2026-07-24,Data Analyst - United Overseas Bank,United Overseas Bank,Singapore,data analyst,0,0.232,0.035,,False,"Role explicitly requires 3-5 years of experience in data analytics roles, but student only has 4 months of internship experience. Additionally, posting emphasizes senior IC/workstream lead responsibilities and regulatory banking expertise that exceed a final-year graduate's typical background.",False,not_applied
5811874443,2026-07-23,2026-07-24,Regional Development Partner (Must have regional partnerships experience),TECHX VENTURES PTE. LTD.,Singapore,business analyst,0,0.214,0.0,,False,"This role is fundamentally a business development/partnership management position requiring extensive relationship-building and negotiation experience, whereas the student's background is in data analytics, operations research, and quantitative finance. The posting explicitly requires 'regional partnerships experience' which the student does not have.",False,not_applied
